{
  "schemaVersion": 1,
  "id": "db",
  "title": "Database overlay: Prisma, Drizzle, Knex, Supabase and EF Core declaring files and migration folders",
  "rows": [
    {
      "id": "db/overlay.prisma-config",
      "fact": "overlay",
      "value": "database",
      "match": { "fileName": "prisma.config.ts" },
      "note": "Prisma ORM 8 moves configuration into prisma.config.ts; its presence is what tells the two generations apart.",
      "claim": "B15",
      "evidence": "prisma-schema-location.html",
      "version": "Prisma docs, ORM 8",
      "retrieved": "2026-09-17"
    },
    {
      "id": "db/overlay.prisma-contract",
      "fact": "overlay",
      "value": "database",
      "match": { "fileName": "contract.prisma" },
      "note": "ORM 8 renames the schema file to contract.prisma and takes a single contract path rather than a folder.",
      "claim": "B15",
      "evidence": "prisma-schema-overview.html",
      "version": "Prisma docs, ORM 8",
      "retrieved": "2026-09-17"
    },
    {
      "id": "db/overlay.prisma-schema",
      "fact": "overlay",
      "value": "database",
      "match": { "fileName": "schema.prisma" },
      "note": "The pre-8 spelling, still the common one.",
      "claim": "B15",
      "evidence": "prisma-schema-location.html",
      "version": "Prisma docs, ORM 8",
      "retrieved": "2026-09-17"
    },
    {
      "id": "db/overlay.drizzle-config",
      "fact": "overlay",
      "value": "database",
      "match": { "fileNames": ["drizzle.config.ts", "drizzle.config.js"] },
      "note": "Read for dialect, schema and out only. dbCredentials holds connection details and is never copied.",
      "claim": "B16",
      "evidence": "drizzle-config-file.html",
      "version": "Drizzle docs",
      "retrieved": "2026-09-17"
    },
    {
      "id": "db/overlay.knexfile",
      "fact": "overlay",
      "value": "database",
      "match": { "fileNames": ["knexfile.js", "knexfile.ts"] },
      "note": "Records that Knex is in use and the migrations directory when it is a literal; every value under connection is ignored.",
      "claim": "B10",
      "evidence": "npm-registry-dist-tags.txt",
      "version": "knex 3.3.0",
      "retrieved": "2026-09-17"
    },
    {
      "id": "db/overlay.supabase-config",
      "fact": "overlay",
      "value": "database",
      "match": { "relativePath": "supabase/config.toml", "inDirNamed": "supabase" },
      "note": "Generated by supabase init; local defaults include API 54321, database 54322 and Studio 54323. The database port is never turned into a network entry, because it is not HTTP.",
      "claim": "B17",
      "evidence": "supabase-cli-config.html",
      "version": "Supabase docs",
      "retrieved": "2026-09-17"
    },
    {
      "id": "db/migrations.supabase",
      "fact": "migrations",
      "value": "supabase",
      "match": { "relativePath": "supabase/migrations", "dirName": "migrations" },
      "note": "SQL files with a timestamp prefix, applied in timestamp order. Listed, never opened.",
      "claim": "B18",
      "evidence": "supabase-database-migrations.html",
      "version": "Supabase docs",
      "retrieved": "2026-09-17"
    },
    {
      "id": "db/migrations.drizzle",
      "fact": "migrations",
      "value": "drizzle",
      "match": { "dirName": "drizzle" },
      "note": "Migrations are written to the out folder, defaulting to drizzle.",
      "claim": "B16",
      "evidence": "drizzle-config-file.html",
      "version": "Drizzle docs",
      "retrieved": "2026-09-17"
    }
  ]
}
